,Date,Aircraft Model,Airline,Aircraft Type,Incident Type,Incident Cause,Incident Location,Damage,Onboard,Fatalities,Phase,Departure,Destination
1515,2014-06-20,Boeing 767-36NER,Omni Air International,Domestic Non Scheduled Passenger,Accident | repairable-damage,"Landing/takeoff - Tailstrike, Result - Runway mishap",Kabul Airpor...,Substantial,Fatalities: 0 / Occupants: 81,0,Landing (LDG),"Bucharest-Henri Coanda International Airport (OTP/LROP) , Romania","Kabul Airport (KBL/OAKB) , Afghanistan"
1514,2014-06-23,Learjet 35A,GFD,Military,Accident | hull-loss,"Collision - Aircraft, Collision - Aircraft - In flight, Result - Loss of control",near Olsberg-Elpe,Destroyed,Fatalities: 2 / Occupants: 2,2,En route (ENR),"Hohn Air Base (ETNH) , Germany","Hohn Air Base (ETNH) , Germany"
1513,2014-06-24,Airbus A310-324ET,PIA,International Scheduled Passenger,"Criminal occurrence (sabotage, shoot down) | repairable-damage","Result - Normal landing, Security - Shot, Security - Shot - Surface-to-air",near Peshawar-Bac...,Unknown,Fatalities: 1 / Occupants: 190,1,Approach (APR),"Riyadh-King Khalid International Airport (RUH/OERK) , Saudi Arabia","Peshawar-Bacha Khan International Airport (PEW/OPPS) , Pakistan"
1512,2014-06-27,Beechcraft A200 Super King Air,"Air Tropiques, opf UN",Domestic Non Scheduled Passenger,Accident | repairable-damage,"Airplane - Undercarriage, Airplane - Undercarriage - Gear-up landing, Result - Emergency, forced landing - On runway",Bukavu-Kavum...,Substantial,Fatalities: 0 / Occupants: 5,0,Landing (LDG),"Bunia Airport (BUX/FZKA) , Democratic Republic of the Congo","Goma Airport (GOM/FZNA) , Democratic Republic of the Congo"
1510,2014-06-28,Boeing 737-8AS (WL),Ryanair,International Scheduled Passenger,Accident | repairable-damage,"Collision - Aircraft, Collision - Aircraft - On ground (platform), Result - Damaged on the ground",London-Stans...,Minor,Fatalities: 0 / Occupants: 167,0,Taxi (TXI),"Frankfurt-Hahn Airport (HHN/EDFH) , Germany","London-Stansted Airport (STN/EGSS) , United Kingdom"
1511,2014-06-28,Boeing 737-8AS (WL),Ryanair,International Scheduled Passenger,Accident | repairable-damage,"Collision - Aircraft, Collision - Aircraft - On ground (platform), Result - Damaged on the ground",London-Stans...,Substantial,Fatalities: 0 / Occupants: 184,0,Pushback / towing (PBT),"London-Stansted Airport (STN/EGSS) , United Kingdom","Warszawa-Frédéric Chopin Airport (WAW/EPWA) , Poland"
1509,2014-06-29,Airbus A330-223F,"Malaysia Airlines, opf THY",Cargo,Accident | repairable-damage,Result - Damaged on the ground,Astana Inter...,Substantial,Fatalities: 0 / Occupants: 2,0,Taxi (TXI),"Istanbul-Atatürk International Airport (IST/LTBA) , Turkey","Astana International Airport (TSE/UACC) , Kazakhstan"
1508,2014-07-02,Fokker 50,Skyward International Aviation,Cargo,Accident | hull-loss,"Airplane - Engines, Cargo - Overloaded",near Nairobi-Jomo...,Destroyed,Fatalities: 4 / Occupants: 4,4,Initial climb (ICL),"Nairobi-Jomo Kenyatta International Airport (NBO/HKJK) , Kenya","Mogadishu International Airport (MGQ/HCMM) , Somalia"
1507,2014-07-04,Airbus A320-232,Air VIA,International Scheduled Passenger,Accident | repairable-damage,"Landing/takeoff - Tailstrike, Result - Runway mishap",Leipzig Airp...,Substantial,Fatalities: 0 / Occupants: 155,0,Landing (LDG),"Varna Airport (VAR/LBWN) , Bulgaria","Leipzig Airport (LEJ/EDDP) , Germany"
1505,2014-07-06,Britten-Norman BN-2A-26 Islander,Domestic Airways,Domestic Non Scheduled Passenger,Accident | hull-loss,Result - Runway excursion,Monkey Mount...,Substantial,Fatalities: 0 / Occupants: 2,0,Landing (LDG),"Mahdia Airport (MHA/SYMD) , Guyana","Monkey Mountain Airport (MYM/SYMM) , Guyana"
1506,2014-07-06,Britten-Norman BN-2A Islander,ITAB,Ferry/positioning,Accident | hull-loss,"Result - Emergency, forced landing - Outside airport",near Chirundu,Damaged beyond repair,Fatalities: 0 / Occupants: 2,0,En route (ENR),"Lanseria Airport (HLA/FALA) , South Africa","Lubumbashi-Luano Airport (FBM/FZQA) , Democratic Republic of the Congo"
1504,2014-07-07,British Aerospace BAe-125-800B,Sirius-Aero,Ferry/positioning,Accident | hull-loss,Unavailable,Moskva-Vnuko...,Substantial,Fatalities: 0 / Occupants: 3,0,Landing (LDG),"Moskva-Vnukovo Airport (VKO/UUWW) , Russia","Makhachkala Airport (MCX/URML) , Russia"
1503,2014-07-10,ATR 72-212A (ATR 72-500),Precision Air,Domestic Scheduled Passenger,Accident | repairable-damage,Result - Runway excursion,Kilimanjaro ...,Substantial,Fatalities: 0 / Occupants: 40,0,Landing (LDG),"Mwanza Airport (MWZ/HTMW) , Tanzania","Dar es Salaam Julius Nyerere International Airport (DAR/HTDA) , Tanzania"
1502,2014-07-14,Antonov An-26,Ukraine Air Force,Military,"Criminal occurrence (sabotage, shoot down) | hull-loss","Security - Shot, Security - Shot - Surface-to-air",near Izvaryne,Destroyed,Fatalities: 2 / Occupants: 8,2,En route (ENR),Unknown,Unknown
1501,2014-07-14,de Havilland Canada DHC-8-315Q Dash 8,Medavia,-,"Criminal occurrence (sabotage, shoot down) | hull-loss","Result - Damaged on the ground, Security - Destroyed on ground",Tripoli Inte...,Minor,Fatalities: 0 / Occupants: 0,0,Standing (STD),-,-
1500,2014-07-15,Airbus A330-202,Libyan Airlines,-,"Criminal occurrence (sabotage, shoot down) | hull-loss","Result - Damaged on the ground, Security - Destroyed on ground",Tripoli Inte...,Substantial,Fatalities: 0 / Occupants: 0,0,Standing (STD),-,-
1499,2014-07-16,Ilyushin Il-76T,Libyan Air Cargo,-,"Criminal occurrence (sabotage, shoot down) | hull-loss","Result - Damaged on the ground, Security - Destroyed on ground",Tripoli Inte...,Destroyed,Fatalities: 0 / Occupants: 0,0,Standing (STD),-,-
1498,2014-07-16,Canadair CL-600-2B19 Regional Jet CRJ-200ER,"ExpressJet Airlines, opf Delta Connection",Domestic Scheduled Passenger,Accident | hull-loss,Result - Runway mishap,Atlanta-Will...,Substantial,Fatalities: 0 / Occupants:,0,Landing (LDG),"Charlottesville-Albemarle Airport, VA (CHO/KCHO) , United States of America","Atlanta-William B. Hartsfield International Airport, GA (ATL/KATL) , United States of America"
1497,2014-07-17,Boeing 777-2H6ER,Malaysia Airlines,International Scheduled Passenger,"Criminal occurrence (sabotage, shoot down) | hull-loss","Airplane - Airframe, Airplane - Airframe - Fuselage, Result - Loss of control, Result - Loss of control (presumed), Security - Shot, Security - Shot - Surface-to-air",Hrabove,Destroyed,Fatalities: 298 / Occupants: 298,298,En route (ENR),"Amsterdam-Schiphol International Airport (AMS/EHAM) , Netherlands","Kuala Lumpur Subang International Airport (KUL/WMKK) , Malaysia"
1496,2014-07-17,Antonov An-2T,Association for the Support of the Defence,-,"Criminal occurrence (sabotage, shoot down) | hull-loss","Result - Damaged on the ground, Security - Destroyed on ground",Tarasovka Ai...,Destroyed,Fatalities: 0 / Occupants: 0,0,Standing (STD),-,-
1495,2014-07-20,Bombardier CL-600-2D24 Regional Jet CRJ-900ER,Libyan Airlines,-,"Criminal occurrence (sabotage, shoot down) | hull-loss","Result - Damaged on the ground, Security - Destroyed on ground",Tripoli Inte...,Destroyed,Fatalities: 0 / Occupants: 0,0,Standing (STD),-,-
1494,2014-07-20,Airbus A330-202,Afriqiyah Airways,-,"Criminal occurrence (sabotage, shoot down) | hull-loss","Result - Damaged on the ground, Security - Destroyed on ground",Tripoli Inte...,Destroyed,Fatalities: 0 / Occupants: 0,0,Standing (STD),-,-
1493,2014-07-20,ATR 72-212,United Airways,Domestic Scheduled Passenger,Accident | hull-loss,Result - Runway mishap,Cox's Bazar ...,Substantial,Fatalities: 0 / Occupants: 48,0,Landing (LDG),"Dhaka-Shahjalal International Airport (DAC/VGHS) , Bangladesh","Cox's Bazar Airport (CXB/VGCB) , Bangladesh"
1492,2014-07-22,Lockheed C-130J Super Hercules,Italian AF,Military,Accident | hull-loss,"Landing/takeoff - Landing, Landing/takeoff - Landing - Heavy, Result - Runway mishap",Herat Airpor...,Substantial,Fatalities: 0 / Occupants:,0,Landing (LDG),"Abu Dhabi-Bateen Airport (AZI/OMAD) , United Arab Emirates","Herat Airport (HEA/OAHR) , Afghanistan"
1491,2014-07-22,Embraer EMB-110P1 Bandeirante,Aeromás,Cargo,Accident | repairable-damage,"Airplane - Airframe, Airplane - Airframe - Passenger door, Result - Runway mishap",Montevideo-C...,Minor,Fatalities: 0 / Occupants: 3,0,Takeoff (TOF),"Montevideo-Carrasco Airport (MVD/SUMU) , Uruguay",Unknown
1490,2014-07-23,ATR 72-212A (ATR 72-500),TransAsia Airways,Domestic Scheduled Passenger,Accident | hull-loss,"Result - CFIT - Level ground, Weather - Thunderstorm",near Magong Airpo...,Destroyed,Fatalities: 48 / Occupants: 58,48,Approach (APR),"Kaohsiung International Airport (KHH/RCKH) , Taiwan","Magong Airport (MZG/RCQC) , Taiwan"
1489,2014-07-24,McDonnell Douglas DC-9-83 (MD-83),"Swiftair, op.for Air Algérie",International Scheduled Passenger,Accident | hull-loss,Result - Loss of control,near Gossi,Destroyed,Fatalities: 116 / Occupants: 116,116,En route (ENR),"Ouagadougou Airport (OUA/DFFD) , Burkina Faso","Algiers-Houari Boumediene Airport (ALG/DAAG) , Algeria"
1488,2014-07-25,de Havilland Canada DHC-6 Twin Otter 300,Grand Canyon Airlines,Ferry/positioning,Accident | repairable-damage,"Collision - Aircraft, Collision - Aircraft - On ground (platform), Result - Damaged on the ground",Boulder City...,Minor,Fatalities: 0 / Occupants: 2,0,Taxi (TXI),"Boulder City Municipal Airport, NV (BLD/KBVU) , United States of America",Unknown
1487,2014-07-27,Ilyushin Il-76M,Libyan Air Cargo,-,"Criminal occurrence (sabotage, shoot down) | hull-loss","Result - Damaged on the ground, Security - Destroyed on ground",Tripoli Inte...,Destroyed,Fatalities: 0 / Occupants: 0,0,Standing (STD),-,-
1486,2014-07-27,Airbus A320-214,Libyan Airlines,-,"Criminal occurrence (sabotage, shoot down) | hull-loss","Result - Damaged on the ground, Security - Destroyed on ground",Tripoli Inte...,Damaged beyond repair,Fatalities: 0 / Occupants: 0,0,Standing (STD),-,-
1485,2014-07-27,Ilyushin Il-76T,Unknown,-,"Criminal occurrence (sabotage, shoot down) | hull-loss","Result - Damaged on the ground, Security - Destroyed on ground",Tripoli Inte...,Destroyed,Fatalities: 0 / Occupants: 0,0,Standing (STD),-,-
1484,2014-07-28,Embraer EMB-110P1 Bandeirante,Táxi Aéreo Ribeiro,Private,Accident | hull-loss,"Airplane - Undercarriage, Airplane - Undercarriage - Gear-up landing, Result - Emergency, forced landing - Outside airport",near Foz do Iguaç...,Substantial,Fatalities: 0 / Occupants: 4,0,En route (ENR),"Foz Do Iguaçu-Estância Hércules Airport, PR (SSFE) , Brazil","Curitiba-Bacacheri Airport, PR (BFH/SBBI) , Brazil"
1483,2014-07-29,Boeing 737-8AS (WL),Ryanair,International Scheduled Passenger,Accident | repairable-damage,"Landing/takeoff - Landing, Landing/takeoff - Landing - Bounced, Landing/takeoff - Tailstrike, Result - Runway mishap",London-Stans...,Substantial,Fatalities: 0 / Occupants: 177,0,Landing (LDG),"Ostrava-Leoš Janácek Airport (OSR/LKMT) , Czech Republic","London-Stansted Airport (STN/EGSS) , United Kingdom"
1482,2014-07-29,Boeing 757-222,United Airlines,Domestic Scheduled Passenger,Accident | hull-loss,"Landing/takeoff - Tailstrike, Result - Runway mishap",San Diego In...,Substantial,Fatalities: 0 / Occupants: 174,0,Landing (LDG),"Houston-George Bush Intercontinental Airport, TX (IAH/KIAH) , United States of America","San Diego International Airport, CA (SAN/KSAN) , United States of America"
1469,2014-08-01,Antonov An-2R,Lugansk Airlines,-,"Criminal occurrence (sabotage, shoot down) | hull-loss","Result - Damaged on the ground, Security - Destroyed on ground",Lugansk Airp...,Destroyed,Fatalities: 0 / Occupants: 0,0,Standing (STD),-,-
1481,2014-08-06,Antonov An-2R,Yug Line,Agricultural,Accident | hull-loss,"Result - Emergency, forced landing - Outside airport","near Prototskiye,...",Damaged beyond repair,Fatalities: 0 / Occupants: 2,0,Landing (LDG),"Prototskiye Airstrip , Russia","Prototskiye Airstrip , Russia"
1480,2014-08-09,Canadair CL-600-2D24 Regional Jet CRJ-900ER,"Mesa Airlines, opf US Airways",Domestic Scheduled Passenger,Accident | repairable-damage,Result - Damaged on the ground,San Antonio ...,Substantial,Fatalities: 0 / Occupants: 80,0,Pushback / towing (PBT),"San Antonio International Airport, TX (SAT/KSAT) , United States of America","Phoenix-Sky Harbor International Airport, AZ (PHX/KPHX) , United States of America"
1479,2014-08-10,HESA IrAn-140-100,Sepahan Airlines,Domestic Scheduled Passenger,Accident | hull-loss,Result - Loss of control,near Tehran-Mehra...,Destroyed,Fatalities: 40 / Occupants: 48,40,Initial climb (ICL),"Tehran-Mehrabad Airport (THR/OIII) , Iran","Tabas Airport (TCX/OIMT) , Iran"
1478,2014-08-10,de Havilland Canada DHC-8-102,"Piedmont Airlines, op.for US Airways Express",Domestic Scheduled Passenger,Accident | repairable-damage,"Collision - Object, Collision - Object - Bird, Result - Emergency, forced landing - On runway",near Harrisburg I...,Substantial,Fatalities: 0 / Occupants: 20,0,Initial climb (ICL),"Harrisburg International Airport, PA (MDT/KMDT) , United States of America","Philadelphia International Airport, PA (PHL/KPHL) , United States of America"
1477,2014-08-13,Cessna 560XLS+ Citation XLS+,AF Andrade Empr. e Part.,Executive,Accident | hull-loss,"Result - Loss of control, Result - Loss of control (presumed)","Santos, SP",Destroyed,Fatalities: 7 / Occupants: 7,7,Approach (APR),"Rio de Janeiro-Santos Dumont Airport, RJ (SDU/SBRJ) , Brazil","Guarujá Airport, SP (SSZ/SBST) , Brazil"
1476,2014-08-15,British Aerospace 3102 Jetstream 31,Links Air,Domestic Scheduled Passenger,Accident | hull-loss,"Airplane - Undercarriage, Airplane - Undercarriage - Landing gear collapse, Result - Runway mishap",Doncaster/Sh...,Substantial,Fatalities: 0 / Occupants: 3,0,Landing (LDG),"Belfast City Airport (BHD/EGAC) , United Kingdom","Doncaster/Sheffield-Robin Hood Airport (DSA/EGCN) , United Kingdom"
1475,2014-08-20,Cessna 208B Grand Caravan,Martinaire,-,"other occurrence (ground fire, sabotage) | hull-loss",Result - Damaged on the ground,Raleigh/Durh...,Substantial,Fatalities: 0 / Occupants: 0,0,Standing (STD),Unknown,Unknown
1474,2014-08-23,Let L-410UVP,Doren Air Congo,Cargo,Accident | hull-loss,Unavailable,Mulume Munene,Destroyed,Fatalities: 4 / Occupants: 4,4,En route (ENR),"Bukavu-Kavumu Airport (BKY/FZMA) , Democratic Republic of the Congo","Kama , Democratic Republic of the Congo"
1473,2014-08-26,Cessna 208B Grand Caravan,Colombian Army,Military,Accident | repairable-damage,"Result - Emergency, forced landing - Outside airport","near Mercaderes, ...",Substantial,Fatalities: 0 / Occupants: 7,0,En route (ENR),"Cali Airport (CLO/SKCL) , Colombia","Tumaco-La Florida Airport (TCO/SKCO) , Colombia"
1472,2014-08-29,Beechcraft 200 Super King Air,private,Illegal Flight,Accident | hull-loss,Unavailable,"Ibans, Mosqu...",Substantial,Fatalities: 0 / Occupants:,0,Landing (LDG),Unknown,Unknown
1471,2014-08-30,Antonov An-12BK,Ukraine Air Alliance,Cargo,Accident | hull-loss,Unavailable,near Tamanrasset ...,Destroyed,Fatalities: 7 / Occupants: 7,7,En route (ENR),"Tamanrasset Airport (TMR/DAAT) , Algeria","Bamako Airport (BKO/GABS) , Mali"
1470,2014-08-31,Fokker F-27 Friendship 500,Safari Express Cargo,Cargo,Accident | hull-loss,Unavailable,near Kogatende,Destroyed,Fatalities: 3 / Occupants: 3,3,En route (ENR),"Mwanza Airport (MWZ/HTMW) , Tanzania","Nairobi-Jomo Kenyatta International Airport (NBO/HKJK) , Kenya"
1468,2014-09-06,Fokker 50,"Skyward International Aviation, op.for Jubba Airways",Domestic Scheduled Passenger,Accident | repairable-damage,Result - Runway excursion,Mogadishu In...,Substantial,Fatalities: 0 / Occupants: 24,0,Landing (LDG),"Galkayo Airport (GLK/HCMR) , Somalia","Mogadishu International Airport (MGQ/HCMM) , Somalia"
1467,2014-09-09,Cessna 208B Grand Caravan,Enggang Air Service,Domestic Non Scheduled Passenger,Accident | repairable-damage,Result - Runway excursion,Mulia Airpor...,Substantial,Fatalities: 0 / Occupants: 11,0,Landing (LDG),"Jayapura-Sentani Airport (DJJ/WAJJ) , Indonesia","Mulia Airport (LII/WABQ) , Indonesia"
1466,2014-09-09,Beechcraft 200C Super King Air,Air Loyauté,Domestic Non Scheduled Passenger,Accident | hull-loss,"Airplane - Undercarriage, Airplane - Undercarriage - Landing gear collapse, Result - Runway mishap",Nouméa-La To...,Substantial,Fatalities: 0 / Occupants: 4,0,Landing (LDG),"Lifou Airport (LIF/NWWL) , New Caledonia","Nouméa-Magenta Airport (GEA/NWWM) , New Caledonia"
1465,2014-09-12,Cessna 500 Citation I,Plaisir en Vol,-,"other occurrence (ground fire, sabotage) | hull-loss","Fire - Hangar, ground fire, Result - Damaged on the ground",Athens Munic...,Destroyed,Fatalities: 0 / Occupants: 0,0,Standing (STD),-,-
1464,2014-09-12,Embraer EMB-145XR,"United Express, opb ExpressJet Airlines",Domestic Scheduled Passenger,Accident | repairable-damage,"Collision - Object, Collision - Object - Airport equipment, Result - Damaged on the ground",Chicago-O'Ha...,Substantial,Fatalities: 0 / Occupants: 37,0,Taxi (TXI),"Sioux Falls Regional Airport (Jo Foss Field), SD (FSD/KFSD) , United States of America","Chicago-O'Hare International Airport, IL (ORD/KORD) , United States of America"
1463,2014-09-14,Beechcraft 300LW Super King Air,Tango Jet,Private,Accident | hull-loss,Result - Loss of control,"Nordelta, BA",Destroyed,Fatalities: 2 / Occupants: 2,2,En route (ENR),"Estancia La Nueva Airstrip, BA , Argentina","Buenos Aires-Jorge Newbery Airport, BA (AEP/SABE) , Argentina"
1462,2014-09-15,Boeing 757-223 (WL),American Airlines,Domestic Scheduled Passenger,Accident | hull-loss,"Landing/takeoff - Tailstrike, Result - Runway mishap",Miami Intern...,Substantial,Fatalities: 0 / Occupants: 172,0,Landing (LDG),"San Juan-Luis Muñoz Marín International Airport (SJU/TJSJ) , Puerto Rico","Miami International Airport, FL (MIA/KMIA) , United States of America"
1461,2014-09-17,Dornier Do-128-G92 Turbo Skyservant,Unknown,Parachuting,Accident | repairable-damage,Unavailable,near Varrelbusch ...,Substantial,Fatalities: 0 / Occupants:,0,En route (ENR),"Varrelbusch Airfield (VAC/EDWU) , Germany","Varrelbusch Airfield (VAC/EDWU) , Germany"
1460,2014-09-19,Embraer EMB-505 Phenom 300,NetJets,Ferry/positioning,Accident | repairable-damage,Result - Runway excursion,Conroe-Lone ...,Substantial,Fatalities: 0 / Occupants: 2,0,Landing (LDG),"Nashville International Airport, TN (BNA/KBNA) , United States of America","Conroe-Lone Star Executive Airport, TX (CXO/KCXO) , United States of America"
1458,2014-09-20,Antonov An-32RE,Indian AF,Military,Accident | hull-loss,"Landing/takeoff - Landing, Landing/takeoff - Landing - Heavy, Result - Runway mishap",Chandigarh A...,Substantial,Fatalities: 0 / Occupants: 9,0,Landing (LDG),"Bhatinda Airport (BUP/VIBT) , India","Chandigarh Airport (IXC/VICG) , India"
1459,2014-09-20,de Havilland Canada DHC-6 Twin Otter 300,Hevilift,Domestic Non Scheduled Passenger,Accident | hull-loss,"Result - CFIT - Hill, mountain",near Port Moresby...,Destroyed,Fatalities: 4 / Occupants: 9,4,En route (ENR),"Woitape Airport (WTP/AYWT) , Papua New Guinea","Port Moresby-Jacksons International Airport (POM/AYPY) , Papua New Guinea"
1457,2014-09-21,Lockheed C-130H Hercules,Egyptian AF,Military,Accident | hull-loss,Unavailable,"Kom Ashwin, ...",Damaged beyond repair,Fatalities: 6 / Occupants: 7,6,Unknown (UNK),Unknown,Unknown
1456,2014-09-24,Antonov An-2,2nd Arkhangelsk United Aviation Division,Domestic Scheduled Passenger,Accident | repairable-damage,Unavailable,Shoyna Airport,Substantial,Fatalities: 0 / Occupants: 10,0,Takeoff (TOF),"Shoyna Airport (ULBO) , Russia","Vaskovo Airport (ULAH) , Russia"
1455,2014-09-26,Beechcraft A100 King Air,Air Creebec,Domestic Scheduled Passenger,Accident | hull-loss,"Airplane - Undercarriage, Airplane - Undercarriage - Gear-up landing, Result - Emergency, forced landing - On runway",Timmins Airp...,Substantial,Fatalities: 0 / Occupants: 9,0,Landing (LDG),"Moosonee Airport, ON (YMO/CYMO) , Canada","Timmins Airport, ON (YTS/CYTS) , Canada"
1454,2014-09-28,de Havilland Canada DHC-6 Twin Otter 300,Air Labrador,Domestic Non Scheduled Passenger,Accident | repairable-damage,Result - Runway mishap,La Tabatière...,Substantial,Fatalities: 0 / Occupants: 19,0,Landing (LDG),"Lourdes-de-Blanc-Sablon Airport, QC (YBX/CYBX) , Canada","La Tabatière Airport, QC (ZLT) , Canada"
1453,2014-09-28,PADC/Pilatus Britten-Norman BN-2A-26 Islander,Air Flamenco,Domestic Non Scheduled Passenger,Accident | repairable-damage,"Flightcrew - Incapacitation, Result - Runway excursion",Ceiba-Jose A...,Substantial,Fatalities: 0 / Occupants: 7,0,Taxi (TXI),"Ceiba-Jose Aponte de la Torre Airport (TJVR) , Puerto Rico","Culebra Airport (CPX/TJCP) , Puerto Rico"
1452,2014-10-01,Embraer ERJ 190-100 STD (ERJ-190STD),KLM Cityhopper,International Scheduled Passenger,Accident | repairable-damage,"Landing/takeoff - Landing, Landing/takeoff - Landing - Heavy, Result - Runway mishap",Amsterdam-Sc...,Minor,Fatalities: 0 / Occupants: 90,0,Landing (LDG),"Praha-Václav Havel Airport (PRG/LKPR) , Czech Republic","Amsterdam-Schiphol International Airport (AMS/EHAM) , Netherlands"
1451,2014-10-05,Embraer EMB-145LR (ERJ-145LR),"Delta Connection, opb Chautauqua Airlines",Domestic Scheduled Passenger,Accident | repairable-damage,"Collision - Aircraft, Collision - Aircraft - On ground (platform), Result - Damaged on the ground",New York-Joh...,Substantial,Fatalities: 0 / Occupants: 48,0,Standing (STD),"Charleston International Airport, SC (CHS/KCHS) , United States of America","New York-John F. Kennedy International Airport, NY (JFK/KJFK) , United States of America"
1450,2014-10-05,Airbus A340-212,Royal Jordanian,International Scheduled Passenger,Accident | repairable-damage,"Collision - Aircraft, Collision - Aircraft - On ground (platform), Result - Damaged on the ground",New York-Joh...,Minor,Fatalities: 0 / Occupants: 180,0,Taxi (TXI),"Amman-Queen Alia International Airport (AMM/OJAI) , Jordan","New York-John F. Kennedy International Airport, NY (JFK/KJFK) , United States of America"
1449,2014-10-07,Boeing 737-8AS (WL),Ryanair,International Scheduled Passenger,Accident | repairable-damage,"Collision - Aircraft, Collision - Aircraft - On ground (platform), Result - Damaged on the ground",Dublin Airpo...,Minor,Fatalities: 0 / Occupants: 94,0,Taxi (TXI),"Dublin Airport (DUB/EIDW) , Ireland","Edinburgh-Turnhouse Airport (EDI/EGPH) , United Kingdom"
1448,2014-10-07,Boeing 737-8AS (WL),Ryanair,International Scheduled Passenger,Accident | repairable-damage,"Collision - Aircraft, Collision - Aircraft - On ground (platform), Result - Damaged on the ground",Dublin Airpo...,Minor,Fatalities: 0 / Occupants: 108,0,Taxi (TXI),"Dublin Airport (DUB/EIDW) , Ireland","Bruxelles-Sud Charleroi Airport (CRL/EBCI) , Belgium"
1447,2014-10-12,British Aerospace 3101 Jetstream 31,ACSA - Air Century,Int'l Non Scheduled Passenger,Accident | hull-loss,Result - Runway excursion,Punta Cana I...,Destroyed,Fatalities: 0 / Occupants: 13,0,Landing (LDG),"San Juan-Luis Muñoz Marín International Airport (SJU/TJSJ) , Puerto Rico","Punta Cana International Airport (PUJ/MDPC) , Dominican Republic"
1446,2014-10-13,Cessna 525A CitationJet CJ2,Fly Tyrol,Private,Accident | hull-loss,Result - Damaged on the ground,Milano-Linat...,Substantial,Fatalities: 0 / Occupants: 3,0,Taxi (TXI),Unknown,Unknown
1444,2014-10-16,Beechcraft 200 Super King Air,SATA,Unknown,Accident | repairable-damage,"Airplane - Undercarriage, Airplane - Undercarriage - Landing gear collapse, Result - Runway mishap",Los Roques A...,Substantial,Fatalities: 0 / Occupants: 7,0,Landing (LDG),"Caracas/La Carlota-Gen. Francisco de Miranda Air Base (SVFM) , Venezuela","Los Roques Airport (LRV/SVRS) , Venezuela"
1443,2014-10-16,Boeing 737-330 (SF),Aloha Air Cargo,Cargo,Accident | repairable-damage,"Cargo - Shift, Result - Normal landing",Lanai Airpor...,Substantial,Fatalities: 0 / Occupants: 3,0,Takeoff (TOF),"Lanai Airport, HI (LNY/PHNY) , United States of America","Honolulu-Daniel K. Inouye International Airport, HI (HNL/PHNL) , United States of America"
1445,2014-10-16,Dassault Falcon 50,CABI Airlines,-,"Criminal occurrence (sabotage, shoot down) | hull-loss","Result - Damaged on the ground, Security - Destroyed on ground",Donetsk Airp...,Destroyed,Fatalities: 0 / Occupants: 0,0,Standing (STD),-,-
1442,2014-10-19,Grumman American G-1159 Gulfstream II,Unknown,Illegal Flight,"Criminal occurrence (sabotage, shoot down) | hull-loss",Result - Damaged on the ground,near Calabozo,Damaged beyond repair,Fatalities:  / Occupants:,0,Standing (STD),Unknown,Unknown
1441,2014-10-20,Dassault Falcon 50EX,Unijet,Executive,Accident | hull-loss,"Collision - Object, Collision - Object - Airport equipment, Result - Runway mishap",Moskva-Vnuko...,Destroyed,Fatalities: 4 / Occupants: 4,4,Takeoff (TOF),"Moskva-Vnukovo Airport (VKO/UUWW) , Russia","Paris-Le Bourget Airport (LBG/LFPB) , France"
1440,2014-10-20,Dornier 328-110,Private Wings,Domestic Non Scheduled Passenger,Accident | repairable-damage,"Landing/takeoff - Landing, Landing/takeoff - Landing - Heavy, Result - Runway mishap",Braunschweig...,Substantial,Fatalities: 0 / Occupants: 34,0,Landing (LDG),"Ingolstadt/Manching Airport (IGS/ETSI) , Germany","Braunschweig-Wolfsburg Airport (BWE/EDVE) , Germany"
1439,2014-10-22,Boeing 757-232 (WL),Delta Air Lines,Domestic Scheduled Passenger,Accident | repairable-damage,"Collision - Aircraft, Collision - Aircraft - On ground (platform), Result - Damaged on the ground",Minneapolis-...,Minor,Fatalities: 0 / Occupants: 190,0,Standing (STD),"Minneapolis-St. Paul International Airport, MN (MSP/KMSP) , United States of America","Los Angeles International Airport, CA (LAX/KLAX) , United States of America"
