,Date,Aircraft Model,Airline,Aircraft Type,Incident Type,Incident Cause,Incident Location,Damage,Onboard,Fatalities,Phase,Departure,Destination
676,2010-10-25,Beechcraft 100 King Air,Kenn Borek Air,Domestic Non Scheduled Passenger,Accident | hull-loss,Result - Undershoot / overshoot,Kirby Lake A...,Damaged beyond repair,Fatalities: 1 / Occupants: 10,1,Approach (APR),"Edmonton Municipal Airport, AB (YXD/CYXD) , Canada",Unknown
675,2010-10-27,PZL-Mielec M28-05PI Skytruck,Indonesian Police,Military,Accident | hull-loss,Unavailable,near Wami,Damaged beyond repair,Fatalities: 5 / Occupants: 5,5,En route (ENR),"Nabire Airport (NBX/WABI) , Indonesia","Ambon-Pattimura Airport (AMQ/WAPP) , Indonesia"
674,2010-10-31,Airbus A310-304F,THY,Cargo,Accident | hull-loss,Result - Runway excursion,Casablanca-M...,Substantial,Fatalities: 0 / Occupants:,0,Landing (LDG),"Istanbul-Atatürk International Airport (IST/LTBA) , Turkey","Casablanca-Mohamed V Airport (CMN/GMMN) , Morocco"
673,2010-11-02,Boeing 737-4Y0,Lion Air,Domestic Scheduled Passenger,Accident | hull-loss,"Landing/takeoff - Landing, Landing/takeoff - Landing - Unstabilized approach, Result - Runway excursion",Pontianak-Su...,Substantial,Fatalities: 0 / Occupants: 175,0,Landing (LDG),"Jakarta-Soekarno-Hatta International Airport (CGK/WIII) , Indonesia","Pontianak-Supadio Airport (PNK/WIOO) , Indonesia"
668,2010-11-04,Beechcraft A100 King Air,"Kenn Borek Air, op.for Aklak Air",-,"other occurrence (ground fire, sabotage) | hull-loss","Fire - Hangar, ground fire, Result - Damaged on the ground",Inuvik/Mike ...,Damaged beyond repair,Fatalities: 0 / Occupants: 0,0,Standing (STD),-,-
669,2010-11-04,Beechcraft B99 Airliner,"Kenn Borek Air, op.for Aklak Air",-,"other occurrence (ground fire, sabotage) | hull-loss","Fire - Hangar, ground fire, Result - Damaged on the ground",Inuvik/Mike ...,Destroyed,Fatalities: 0 / Occupants: 0,0,Standing (STD),-,-
672,2010-11-04,ATR 72-212,Aerocaribbean,Domestic Scheduled Passenger,Accident | hull-loss,"Result - Loss of control, Weather - Icing","near Guasimal, Sa...",Destroyed,Fatalities: 68 / Occupants: 68,68,En route (ENR),"Santiago-Antonio Maceo Airport (SCU/MUCU) , Cuba","Havana-José Martí International Airport (HAV/MUHA) , Cuba"
671,2010-11-04,Airbus A380-842,Qantas,International Scheduled Passenger,Accident | repairable-damage,"Airplane - Engines, Airplane - Engines - Uncontained failure, Result - Emergency, forced landing - On runway",near Batam Island,Substantial,Fatalities: 0 / Occupants: 469,0,En route (ENR),"Singapore-Changi International Airport (SIN/WSSS) , Singapore","Sydney-Kingsford Smith International Airport, NSW (SYD/YSSY) , Australia"
670,2010-11-04,de Havilland Canada DHC-6 Twin Otter 300,"Kenn Borek Air, op.for Aklak Air",-,"other occurrence (ground fire, sabotage) | hull-loss","Fire - Hangar, ground fire, Result - Damaged on the ground",Inuvik/Mike ...,Destroyed,Fatalities: 0 / Occupants: 0,0,Standing (STD),-,-
667,2010-11-05,Beechcraft 1900C-1,JS Air,Domestic Non Scheduled Passenger,Accident | hull-loss,Result - Loss of control,near Karachi-Jinn...,Destroyed,Fatalities: 21 / Occupants: 21,21,Initial climb (ICL),"Karachi-Jinnah International Airport (KHI/OPKC) , Pakistan","Bhit Airfield , Pakistan"
666,2010-11-05,Swearingen SA227-AC Metro III,LC Busre,Domestic Scheduled Passenger,Accident | hull-loss,"Airplane - Undercarriage, Airplane - Undercarriage - Gear-up landing, Landing/takeoff - Landing, Landing/takeoff - Landing - Bounced, Result - Runway mishap",Huánuco-Alfé...,Substantial,Fatalities: 0 / Occupants: 9,0,Landing (LDG),"Lima-Jorge Chávez International Airport (LIM/SPIM) , Peru","Huánuco-Alférez FAP David Figueroa Fernandini Airport (HUU/SPHV) , Peru"
665,2010-11-06,Douglas DC-3C,LASER,Cargo,Accident | repairable-damage,"Airplane - Systems, Airplane - Systems - Hydraulics",Guerima Airport,Substantial,Fatalities: 0 / Occupants: 3,0,Landing (LDG),"Villavicencio Airport (VVC/SKVV) , Colombia","Guerima Airport , Colombia"
664,2010-11-07,Canadair CL-600-2B16 Challenger 604,Aviation Enterprises,-,"other occurrence (ground fire, sabotage) | hull-loss","Fire - Hangar, ground fire, Result - Damaged on the ground",Indianapolis...,Damaged beyond repair,Fatalities: 0 / Occupants: 0,0,Standing (STD),-,-
663,2010-11-09,Shorts SC.7 Skyvan 3-100,Guyana AF,Military,Accident | repairable-damage,Unavailable,Georgetown-C...,Substantial,Fatalities: 0 / Occupants:,0,Landing (LDG),Unknown,"Georgetown-Cheddi Jagan International Airport (GEO/SYCJ) , Guyana"
662,2010-11-11,Antonov An-24B,Tarco Air,Cargo,Accident | hull-loss,Unavailable,Zalingei Air...,Damaged beyond repair,Fatalities: 6 / Occupants: 38,6,Landing (LDG),"Khartoum-Civil Airport (KRT/HSSS) , Sudan","Zalingei Airport (ZLX/HSZA) , Sudan"
661,2010-11-13,Swearingen SA227-AC Metro III,LC Busre,Domestic Scheduled Passenger,Accident | hull-loss,"Airplane - Undercarriage, Airplane - Undercarriage - Brakes, Result - Runway excursion",Andahuaylas ...,Substantial,Fatalities: 0 / Occupants: 19,0,Landing (LDG),"Huaraz/Anta-Comandante FAP Germán Arias Graziani Airport (ATA/SPHZ) , Peru","Andahuaylas Airport (ANS/SPHY) , Peru"
660,2010-11-15,CASA C-212 Aviocar 400,Skytraders,Ferry/positioning,Accident | repairable-damage,Result - Runway mishap,Bunger Hills,Substantial,Fatalities: 0 / Occupants: 4,0,Landing (LDG),Unknown,Unknown
659,2010-11-17,Learjet 25B,Premier Jets,Ferry/positioning,Accident | hull-loss,"Landing/takeoff - Landing, Landing/takeoff - Landing - Late, far down rwy, Result - Runway excursion",Portland-Hil...,Substantial,Fatalities: 0 / Occupants: 2,0,Landing (LDG),"Boise Air Terminal, ID (BOI/KBOI) , United States of America","Portland-Hillsboro Airport, OR (HIO/KHIO) , United States of America"
658,2010-11-18,Lockheed C-130H Hercules,Yemen AF,Military,Accident | repairable-damage,Result - Runway excursion,Sana'a Inter...,Substantial,Fatalities: 0 / Occupants:,0,Landing (LDG),Unknown,"Sana'a International Airport (SAH/ODSN) , Yemen"
657,2010-11-19,Cessna 501 Citation I/SP,Frandley Aviation Partnership,Ambulance,Accident | hull-loss,Unavailable,Birmingham I...,Damaged beyond repair,Fatalities: 0 / Occupants: 2,0,Landing (LDG),"Belfast International Airport (BFS/EGAA) , United Kingdom","Birmingham International Airport (BHX/EGBB) , United Kingdom"
656,2010-11-19,Lockheed C-130H-30 Hercules,Algerian AF,Cargo,Accident | repairable-damage,Result - Runway excursion,Paris-Le Bou...,Substantial,Fatalities: 0 / Occupants: 9,0,Landing (LDG),"Boufarik Air Base (DAAK) , Algeria","Paris-Le Bourget Airport (LBG/LFPB) , France"
655,2010-11-24,Antonov An-32B,Mexican AF,Military,Accident | hull-loss,Unavailable,Monterrey-Ge...,Damaged beyond repair,Fatalities: 5 / Occupants: 5,5,Takeoff (TOF),"Monterrey-General Mariano Escobedo International Airport (MTY/MMMY) , Mexico","Santa Lucía Air Base (NLU/MMSM) , Mexico"
654,2010-11-26,Boeing 747-430,Lufthansa,International Scheduled Passenger,Accident | repairable-damage,"Airplane - Undercarriage, Airplane - Undercarriage - Landing gear collapse",Frankfurt In...,Substantial,Fatalities: 0 / Occupants: 274,0,Taxi (TXI),"Frankfurt International Airport (FRA/EDDF) , Germany","Buenos Aires/Ezeiza-Ministro Pistarini Airport, BA (EZE/SAEZ) , Argentina"
653,2010-11-28,Ilyushin Il-76TD,Sun Way,Cargo,Accident | hull-loss,"Airplane - Engines, Airplane - Engines - Uncontained failure, Maintenance - Engine (deficient, inspections etc), Result - Loss of control",near Karachi-Jinn...,Destroyed,Fatalities: 8 / Occupants: 8,11,Initial climb (ICL),"Karachi-Jinnah International Airport (KHI/OPKC) , Pakistan","Khartoum-Civil Airport (KRT/HSSS) , Sudan"
652,2010-12-03,Beechcraft 1900C-1,Kaya Airlines,Domestic Scheduled Passenger,Accident | hull-loss,Unavailable,near Maputo Inter...,Damaged beyond repair,Fatalities: 0 / Occupants: 17,0,Approach (APR),"Nampula Airport (APL/FQNP) , Mozambique","Maputo International Airport (MPM/FQMA) , Mozambique"
651,2010-12-04,Tupolev Tu-154M,Dagestan Airlines,Domestic Scheduled Passenger,Accident | hull-loss,Result - Runway excursion,Moskva-Domod...,Destroyed,Fatalities: 2 / Occupants: 171,2,Landing (LDG),"Moskva-Vnukovo Airport (VKO/UUWW) , Russia","Makhachkala Airport (MCX/URML) , Russia"
650,2010-12-07,Dassault Falcon 20F-5B,La Estrella S.A. Compañía de Seguros de Retiro,Private,Accident | repairable-damage,"Collision - Object, Collision - Object - Trees",San Fernando...,Substantial,Fatalities: 0 / Occupants: 8,0,Initial climb (ICL),"San Fernando Airport, BA (FDO/SADF) , Argentina","Mendoza-El Plumerillo Airport, MD (MDZ/SAME) , Argentina"
649,2010-12-08,IRMA/Pilatus Britten-Norman BN-2T Islander,"Ministry of Marine, Fisheries and Merchant Navy",Unknown,Accident | hull-loss,Unavailable,near Demnate,Damaged beyond repair,Fatalities: 5 / Occupants: 5,5,En route (ENR),"Tangier Airport (TNG/GMTT) , Morocco","Ouarzazate Airport (OZZ/GMMZ) , Morocco"
648,2010-12-09,Boeing 737-4U3,Garuda,Unknown,"other occurrence (ground fire, sabotage) | hull-loss",Result - Damaged on the ground,Jakarta-Soek...,Damaged beyond repair,Fatalities: 0 / Occupants:,0,Standing (STD),Unknown,Unknown
647,2010-12-14,Antonov An-24RV,Nordavia,Domestic Scheduled Passenger,Accident | hull-loss,Result - Runway excursion,Rogachevo Ai...,Substantial,Fatalities: 0 / Occupants: 39,0,Landing (LDG),"Arkhangelsk-Talaghy Airport (ARH/ULAA) , Russia","Rogachevo Air Base (ULDR) , Russia"
646,2010-12-15,de Havilland Canada DHC-6 Twin Otter 310,Tara Air,Domestic Scheduled Passenger,Accident | hull-loss,"Result - CFIT - Hill, mountain (presumed)",near Sri Chaur Vi...,Damaged beyond repair,Fatalities: 22 / Occupants: 22,22,En route (ENR),"Lamidanda Airport (LDN/VNLD) , Nepal","Kathmandu-Tribhuvan Airport (KTM/VNKT) , Nepal"
645,2010-12-17,Airbus A330-243,MEA,International Scheduled Passenger,Accident | repairable-damage,"Collision - Object, Result - Damaged on the ground",Paris-Charle...,Substantial,Fatalities: 0 / Occupants:,0,Pushback / towing (PBT),"Paris-Charles de Gaulle Airport (CDG/LFPG) , France","Beirut International Airport (BEY/OLBA) , Lebanon"
644,2010-12-18,Swearingen SA226-TC Metro II,Perimeter Airlines,Ambulance,Accident | repairable-damage,Result - Runway excursion,Sanikiluaq A...,Substantial,Fatalities: 0 / Occupants: 3,0,Landing (LDG),"Gods Lake Narrows Airport, MB (YGO/CYGO) , Canada","Sanikiluaq Airport, NU (YSK/CYSK) , Canada"
643,2010-12-19,Hawker Beechcraft 390 Premier IA,Windrose Air,Executive,Accident | hull-loss,Result - Loss of control,near St. Moritz-S...,Destroyed,Fatalities: 2 / Occupants: 2,2,Landing (LDG),"Zagreb-Pleso Airport (ZAG/LDZA) , Croatia","St. Moritz-Samedan Airport (SMV/LSZS) , Switzerland"
642,2010-12-20,Antonov An-2P,2nd Sverdlovsk Aviation Enterprise,-,"other occurrence (ground fire, sabotage) | hull-loss",Result - Damaged on the ground,Uktus Airport,Damaged beyond repair,Fatalities: 0 / Occupants: 0,0,Standing (STD),-,-
641,2010-12-20,Antonov An-2TP,2nd Sverdlovsk Aviation Enterprise,-,"other occurrence (ground fire, sabotage) | hull-loss",Result - Damaged on the ground,Uktus Airport,Damaged beyond repair,Fatalities: 0 / Occupants: 0,0,Standing (STD),-,-
640,2010-12-28,Antonov An-22A,Russian AF,Military,Accident | hull-loss,Unavailable,near Krasny Oktya...,Destroyed,Fatalities: 12 / Occupants: 12,12,En route (ENR),"Voronezh Airport (VOZ/UUOO) , Russia","Tver-Migalovo Airport (KLD/UUEM) , Russia"
1017,2011-01-01,Tupolev Tu-154B-2,Kolavia,Domestic Scheduled Passenger,Accident | hull-loss,"Fire - Fire, Result - Damaged on the ground",Surgut Airpo...,Destroyed,Fatalities: 3 / Occupants: 134,3,Standing (STD),"Surgut Airport (SGC/USRR) , Russia","Moskva-Domodedovo Airport (DME/UUDD) , Russia"
828,2011-01-01,Antonov An-24RV,Katekavia,Unknown,Accident | hull-loss,"Landing/takeoff - Landing, Landing/takeoff - Landing - Heavy, Result - Runway mishap",Chita Airpor...,Substantial,Fatalities: 0 / Occupants:,0,Landing (LDG),Unknown,"Chita Airport (HTA/UIAA) , Russia"
1016,2011-01-03,Beechcraft B200 King Air,Saskatchewan Gvt.,Ambulance,Accident | repairable-damage,Result - Runway excursion,Maple Creek ...,Substantial,Fatalities: 0 / Occupants: 3,0,Landing (LDG),"Saskatoon Airport, SK (YXE/CYXE) , Canada","Maple Creek Airport, SK , Canada"
1015,2011-01-03,Boeing 737-823 (WL),American Airlines,International Scheduled Passenger,Accident | repairable-damage,"Landing/takeoff - Tailstrike, Result - Runway mishap",Los Angeles ...,Substantial,Fatalities: 0 / Occupants: 165,0,Takeoff (TOF),"Los Angeles International Airport, CA (LAX/KLAX) , United States of America","Toronto-Pearson International Airport, ON (YYZ/CYYZ) , Canada"
1014,2011-01-05,Boeing 737-8F2 (WL),THY,International Scheduled Passenger,Hijacking | repairable-damage,"Result - Hijacking - Hijacker(s) overpowered by occupants, Security - Hijack",Istanbul Ata...,None,Fatalities: 0 / Occupants: 60,0,En route (ENR),"Oslo-Gardermoen Airport (OSL/ENGM) , Norway","Istanbul-Atatürk International Airport (IST/LTBA) , Turkey"
1013,2011-01-06,Learjet 35A,Priester Aviation,Executive,Accident | hull-loss,"Result - Loss of control, Weather - Icing",Springfield-...,Damaged beyond repair,Fatalities: 0 / Occupants: 6,0,Landing (LDG),"Chicago-Midway Airport, IL (MDW/KMDW) , United States of America","Springfield-Abraham Lincoln Capital Airport, IL (SPI/KSPI) , United States of America"
1012,2011-01-06,Cessna 208B Grand Caravan,Hageland Aviation Services,Domestic Scheduled Passenger,Accident | repairable-damage,Result - Runway excursion,Kipnuk Airpo...,Substantial,Fatalities: 0 / Occupants: 6,0,Landing (LDG),"Bethel Airport, AK (BET/PABE) , United States of America","Kipnuk Airport, AK (KPN/PAKI) , United States of America"
1011,2011-01-07,Beechcraft B200 Super King Air,GCE Bail SA,Domestic Non Scheduled Passenger,Accident | hull-loss,"Airplane - Systems, Airplane - Systems - Electrical system, Result - Runway mishap","Montpellier,...",Substantial,Fatalities: 0 / Occupants: 4,0,Landing (LDG),"Montpellier-Fréjorgues Airport (MPL/LFMT) , France","Albert/Bray Airport (BYF/LFAQ) , France"
1010,2011-01-09,Boeing 727-286,Iran Air,Domestic Scheduled Passenger,Accident | hull-loss,Result - Loss of control,near Urmia (Orumi...,Destroyed,Fatalities: 78 / Occupants: 105,78,Approach (APR),"Tehran-Mehrabad Airport (THR/OIII) , Iran","Urmia (Orumiyeh) Airport (OMH/OITR) , Iran"
1009,2011-01-10,Airbus A320-216,AirAsia,Domestic Scheduled Passenger,Accident | repairable-damage,Result - Runway excursion,Kuching Airp...,Substantial,Fatalities: 0 / Occupants: 129,0,Landing (LDG),"Kuala Lumpur Subang International Airport (KUL/WMKK) , Malaysia","Kuching Airport (KCH/WBGG) , Malaysia"
1008,2011-01-10,Boeing 737-2T5,Safair,Domestic Non Scheduled Passenger,Accident | hull-loss,Unavailable,Hoedspruit A...,Substantial,Fatalities: 0 / Occupants: 3,0,Taxi (TXI),"Hoedspruit Airport (HDS/FAHS) , South Africa","Johannesburg-O.R. Tambo International Airport (JNB/FAOR) , South Africa"
1007,2011-01-14,Beechcraft B200 Super King Air,CMN Construtora Meio Norte,Executive,Accident | hull-loss,"Result - CFIT - Hill, mountain",near Senador Cane...,Destroyed,Fatalities: 6 / Occupants: 6,6,Approach (APR),"Brasília-Presidente Juscelino Kubitschek International Airport, DF (BSB/SBBR) , Brazil","Goiânia-Santa Genoveva Airport, GO (GYN/SBGO) , Brazil"
1006,2011-01-17,de Havilland Canada DHC-3T Vazar Turbine Otter,Liard Air,-,"other occurrence (ground fire, sabotage) | hull-loss","Fire - Hangar, ground fire, Result - Damaged on the ground",Muncho Lake/...,Damaged beyond repair,Fatalities: 0 / Occupants: 0,0,Standing (STD),-,-
1005,2011-01-17,Convair CV-340-71,Tiger Contract Cargo,Ferry/positioning,Accident | hull-loss,"Airplane - Engines, Airplane - Engines - Fire, Result - Emergency, forced landing - On runway",Saint Thomas...,Substantial,Fatalities: 0 / Occupants: 2,0,Initial climb (ICL),"Saint Thomas-Cyril E. King Airport (STT/TIST) , U.S. Virgin Islands","San Juan-Luis Muñoz Marín International Airport (SJU/TJSJ) , Puerto Rico"
1004,2011-01-19,Cessna 208B Grand Caravan,Airworks,Unknown,Accident | repairable-damage,Unavailable,Tharjath Air...,Substantial,Fatalities: 0 / Occupants:,0,Takeoff (TOF),"Tharjath Airstrip , South Sudan",Unknown
1003,2011-01-20,de Havilland Canada DHC-6 Twin Otter 300,Ecuador Air Force,Military,Accident | repairable-damage,Unavailable,El Capricho ...,Substantial,Fatalities: 6 / Occupants: 6,6,En route (ENR),"Pastaza-Shell Mera Airport (PTZ/SESM) , Ecuador","Tena Airport (SETE) , Ecuador"
1002,2011-01-27,Fokker F-27 Friendship 500CRF,Fly540,Test,Accident | hull-loss,"Landing/takeoff - Takeoff - Aborted, Result - Runway excursion",Nairobi-Wils...,Substantial,Fatalities: 0 / Occupants: 4,0,Takeoff (TOF),"Nairobi-Wilson Airport (WIL/HKNW) , Kenya","Nairobi-Wilson Airport (WIL/HKNW) , Kenya"
1001,2011-01-30,Gulfstream G-IV,Prime Aviation,Executive,Accident | hull-loss,"Collision - Object, Collision - Object - Airport equipment, Result - Damaged on the ground",Papeete-Faaa...,Substantial,Fatalities: 0 / Occupants:,0,Taxi (TXI),Unknown,"Papeete-Faaa Airport (PPT/NTAA) , French Polynesia"
1000,2011-02-04,Raytheon Hawker 850XP,Sky Lounge Services,Executive,Accident | hull-loss,"Result - Loss of control, Weather - Icing",Sulaymaniyah...,Destroyed,Fatalities: 7 / Occupants: 7,7,Initial climb (ICL),"Sulaymaniyah International Airport (ISU/ORSU) , Iraq","Ankara-Esenboga Airport (ESB/LTAC) , Turkey"
999,2011-02-09,Beechcraft 1900D,Wasaya Airways,Domestic Scheduled Passenger,Accident | repairable-damage,Unavailable,Kasabonika A...,Substantial,Fatalities: 0 / Occupants: 15,0,Landing (LDG),"Wunnummin Lake Airport, ON (WNN) , Canada","Kasabonika Airport, ON (XKS/CYAQ) , Canada"
998,2011-02-10,Swearingen SA227-BC Metro III,"Flightline, op.for Manx2",International Scheduled Passenger,Accident | hull-loss,"Result - Loss of control, Weather - Visibility -low",Cork Airport...,Destroyed,Fatalities: 6 / Occupants: 12,6,Landing (LDG),"Belfast City Airport (BHD/EGAC) , United Kingdom","Cork Airport (ORK/EICK) , Ireland"
997,2011-02-12,CASA/Nurtanio NC-212-A4 Aviocar 100,Sabang Merauke Raya Air Charter,Test,Accident | hull-loss,Result - Loss of control,near Tanjung Pina...,Damaged beyond repair,Fatalities: 5 / Occupants: 5,5,En route (ENR),"Batam-Hang Nadim Airport (BTH/WIDD) , Indonesia","Tanjung Pinang-Kidjang Airport (TNJ/WIDN) , Indonesia"
996,2011-02-14,Let L-410UVP-E20,Central American Airways,Domestic Scheduled Passenger,Accident | hull-loss,Result - Loss of control,El Espino,Destroyed,Fatalities: 14 / Occupants: 14,14,En route (ENR),"San Pedro Sula-Ramon Villeda Morales Airport (SAP/MHLM) , Honduras","Tegucigalpa-Toncontin Airport (TGU/MHTG) , Honduras"
995,2011-02-14,Let L-410UVP,African Air Services Commuter,Cargo,Accident | hull-loss,Unavailable,Mont Biega,Damaged beyond repair,Fatalities: 2 / Occupants: 2,2,En route (ENR),"Bukavu-Kavumu Airport (BKY/FZMA) , Democratic Republic of the Congo","Lusenge Airfield , Democratic Republic of the Congo"
994,2011-02-14,Gulfstream GV-SP (G550),Gulfstream Aerospace,Test,Accident | repairable-damage,"Airplane - Systems, Airplane - Systems - Hydraulics, Result - Runway excursion",Appleton-Out...,Substantial,Fatalities: 0 / Occupants: 3,0,Landing (LDG),"Appleton-Outagamie County Airport, WI (ATW/KATW) , United States of America","Appleton-Outagamie County Airport, WI (ATW/KATW) , United States of America"
993,2011-02-16,Cessna 525 CitationJet CJ1+,Swiss Private Aviation,Ferry/positioning,Accident | repairable-damage,"Airplane - Undercarriage, Airplane - Undercarriage - Brakes, Result - Runway mishap",Grenchen Air...,Substantial,Fatalities: 0 / Occupants: 2,0,Takeoff (TOF),"Grenchen Airport (ZHI/LSZG) , Switzerland","Newquay-Cornwall Airport (NQY/EGHQ) , United Kingdom"
992,2011-02-16,Boeing 747-368,Saudi Arabian,Domestic Scheduled Passenger,Accident | hull-loss,Result - Runway excursion,Madinah-Moha...,Substantial,Fatalities: 0 / Occupants: 277,0,Landing (LDG),"Riyadh-King Khalid International Airport (RUH/OERK) , Saudi Arabia","Madinah-Mohammad Bin Abdulaziz Airport (MED/OEMA) , Saudi Arabia"
991,2011-02-18,Learjet 24,Rutas Aereas Mayas,Unknown,Accident | hull-loss,Unavailable,Pachuca-Inge...,Damaged beyond repair,Fatalities: 2 / Occupants: 2,2,Landing (LDG),"Pachuca-Ingeniero Juan Guillermo Villasana Airport (MMPC) , Mexico","Pachuca-Ingeniero Juan Guillermo Villasana Airport (MMPC) , Mexico"
990,2011-02-21,ATR 72-212,TRIP Linhas Aéreas,Domestic Scheduled Passenger,Accident | hull-loss,"Airplane - Undercarriage, Airplane - Undercarriage - Landing gear collapse, Result - Runway excursion",Altamira Air...,Substantial,Fatalities: 0 / Occupants: 51,0,Landing (LDG),"Belém/Val-de-Cans International Airport, PA (BEL/SBBE) , Brazil","Altamira Airport, PA (ATM/SBHT) , Brazil"
989,2011-02-27,Swearingen SA227-DC Metro 23,Línea Aérea Amaszonas,Domestic Scheduled Passenger,Accident | repairable-damage,"Airplane - Undercarriage, Airplane - Undercarriage - Gear-up landing, Result - Runway mishap",La Paz-El Al...,Substantial,Fatalities: 0 / Occupants: 8,0,Landing (LDG),"San Borja Airport (SRJ/SLSB) , Bolivia","Rurrenabaque Airport (RBQ/SLRQ) , Bolivia"
987,2011-03-02,Cessna S550 Citation S/II,GIO Business Aviation,Ambulance,Accident | repairable-damage,"Landing/takeoff - Takeoff - Aborted, Result - Runway excursion",Forli Airpor...,Substantial,Fatalities: 0 / Occupants: 3,0,Takeoff (TOF),"Forli Airport (FRL/LIPK) , Italy","Torino-Caselle Airport (TRN/LIMF) , Italy"
988,2011-03-02,Swearingen SA227-AC Metro III,"North Flying, op.for Air Norway",Domestic Scheduled Passenger,Accident | hull-loss,Result - Runway excursion,Oslo-Garderm...,Damaged beyond repair,Fatalities: 0 / Occupants: 11,0,Landing (LDG),"Ørland Airport (OLA/ENOL) , Norway","Oslo-Gardermoen Airport (OSL/ENGM) , Norway"
986,2011-03-04,de Havilland Canada DHC-8-106,Flugfélag Íslands - Air Iceland,International Scheduled Passenger,Accident | hull-loss,"Landing/takeoff - Landing, Landing/takeoff - Landing - Heavy, Landing/takeoff - Landing - Unstabilized approach, Result - Runway mishap",Nuuk Airport...,Substantial,Fatalities: 0 / Occupants: 34,0,Landing (LDG),"Kulusuk Airport (KUS/BGKK) , Greenland","Nuuk Airport (GOH/BGGH) , Greenland"
985,2011-03-05,Antonov An-148-100E,VASO,Test,Accident | hull-loss,"Airplane - Airframe, Result - Loss of control","Garbuzovo, B...",Destroyed,Fatalities: 6 / Occupants: 6,6,En route (ENR),"Voronezh-Pridacha Airport (UUOD) , Russia","Voronezh-Pridacha Airport (UUOD) , Russia"
984,2011-03-05,Beechcraft 200 Super King Air,Wyngs Aviation,Private,Accident | hull-loss,Result - Runway excursion,Union Island...,Substantial,Fatalities: 0 / Occupants: 3,0,Landing (LDG),"Porlamar Airport (PMV/SVMG) , Venezuela","Canouan Island Airport (CIW/TVSC) , Saint Vincent and the Grenadines"
983,2011-03-08,de Havilland Canada DHC-6 Twin Otter 100,Desert Sand Aircraft Leasing,Test,Accident | hull-loss,Result - Loss of control,near Clayton Coun...,Destroyed,Fatalities: 2 / Occupants: 2,2,Approach (APR),"Clayton County Airport-Tara Field, GA , United States of America","Clayton County Airport-Tara Field, GA , United States of America"
982,2011-03-10,Swearingen SA227-AC Metro III,Ameriflight,Cargo,Accident | repairable-damage,"Airplane - Undercarriage, Airplane - Undercarriage - Gear-up landing, Result - Runway mishap",Seattle-Boei...,Substantial,Fatalities: 0 / Occupants: 1,0,Landing (LDG),"Lewiston-Nez Perce County Regional Airport, ID (LWS/KLWS) , United States of America","Seattle-Boeing Field International Airport, WA (BFI/KBFI) , United States of America"
979,2011-03-11,Cessna 208 Caravan I,Tokyo Century Lease,-,"other occurrence (ground fire, sabotage) | hull-loss",Result - Damaged on the ground,Sendai Airpo...,Substantial,Fatalities: 0 / Occupants: 0,0,Standing (STD),-,-
981,2011-03-11,Beechcraft 300 King Air 350,Japan Coast Guard,-,"other occurrence (ground fire, sabotage) | hull-loss",Result - Damaged on the ground,Sendai Airpo...,Substantial,Fatalities: 0 / Occupants: 0,0,Standing (STD),-,-
980,2011-03-11,Cessna 208 Caravan I,Kyoritsu Air Survey,-,"other occurrence (ground fire, sabotage) | hull-loss",Result - Damaged on the ground,Sendai Airpo...,Substantial,Fatalities: 0 / Occupants: 0,0,Standing (STD),-,-
978,2011-03-11,Cessna 208B Grand Caravan,MAF,Domestic Non Scheduled Passenger,Accident | repairable-damage,Result - Runway excursion,Mulia Airpor...,Substantial,Fatalities: 0 / Occupants: 10,0,Landing (LDG),"Jayapura-Sentani Airport (DJJ/WAJJ) , Indonesia","Mulia Airport (LII/WABQ) , Indonesia"
977,2011-03-11,Beechcraft 300LW Super King Air,Japan Digital Laboratory,-,"other occurrence (ground fire, sabotage) | hull-loss",Result - Damaged on the ground,Sendai Airpo...,Damaged beyond repair,Fatalities: 0 / Occupants: 0,0,Standing (STD),-,-
976,2011-03-12,Bombardier BD-100-1A10 Challenger 300,Tri Marine Management Co.,Private,Accident | repairable-damage,Result - Runway excursion,Iqaluit Airp...,Unknown,Fatalities: 0 / Occupants: 3,0,Landing (LDG),"Long Beach Municipal Airport, CA (LGB/KLGB) , United States of America","Iqaluit Airport, NU (YFB/CYFB) , Canada"
975,2011-03-16,Beechcraft 200 Super King Air,Carde Equipment Sales,Executive,Accident | hull-loss,"Airplane - Engines, Airplane - Engines - Fuel contamination, Result - Loss of control",Long Beach M...,Destroyed,Fatalities: 5 / Occupants: 6,5,Initial climb (ICL),"Long Beach Municipal Airport, CA (LGB/KLGB) , United States of America","Salt Lake City International Airport, UT (SLC/KSLC) , United States of America"
973,2011-03-17,Yakovlev Yak-40KD,Air Libya,-,"other occurrence (ground fire, sabotage) | hull-loss",Result - Damaged on the ground,Benghazi-Ben...,Damaged beyond repair,Fatalities: 0 / Occupants: 0,0,Standing (STD),-,-
